{
  "$schema": "../../../contracts/pattern-manifest.schema.json",
  "id": "canary.pattern.status-badge-pattern",
  "kind": "pattern",
  "status": "draft",
  "purpose": {
    "summary": "Show the state of a pipeline execution (a run, a stage or a step) as one badge that announces its changes. Holds the StatusBadge rules that are about composition, not about the component. They replace the retired SBD-005, SBD-008, SBD-014 and SBD-015.",
    "useWhen": [
      "The value is an ExecutionState from src/types/execution.ts.",
      "The state can change while the user is looking at it."
    ],
    "doNotUseWhen": [
      "The executions are rows in a hierarchical list (steps within a stage, stages within a pipeline). Tree View renders their status (SBP-004).",
      "The value is a stable attribute, not a state. Use Tag (SBD-001)."
    ]
  },
  "components": [
    {
      "export": "StatusBadge",
      "manifest": "../../components/status-badge/status-badge.manifest.json",
      "role": "Renders the state."
    },
    {
      "export": "Tree",
      "manifest": null,
      "path": "packages/ui/src/components/treeview.tsx",
      "role": "Renders execution state for Folder and File rows in hierarchical lists. No contract yet."
    }
  ],
  "anatomy": [
    {
      "slot": "liveRegion",
      "fill": "div[aria-live=polite]",
      "required": "when the state can change while visible",
      "rules": ["SBP-003"],
      "notes": "StatusBadge has no live region of its own."
    },
    {
      "slot": "badge",
      "fill": "StatusBadge",
      "required": true,
      "props": { "theme": ["success", "warning", "muted", "danger"] },
      "rules": ["SBP-001", "SBP-002", "SBD-006", "SBD-007"],
      "notes": "One state per badge. variant, icon and pulse follow StatusBadge's own constraints (SBD-007)."
    }
  ],
  "states": {
    "source": "packages/ui/src/types/execution.ts ExecutionState",
    "values": [
      "pending",
      "running",
      "success",
      "failure",
      "error",
      "skipped",
      "killed",
      "blocked",
      "waiting_on_dependencies",
      "unknown",
      "failure_ignored",
      "ignorefailed"
    ],
    "map": null,
    "notes": "Not decided (SBP-005): which theme, variant, icon and label each state gets. Tree View's current icon colors are a starting point, not a decision."
  },
  "constraints": [
    {
      "when": "The executions are rows in a hierarchical list",
      "use": "Tree, Folder and File with their status prop",
      "instead": "StatusBadge composed by hand",
      "rule": "SBP-004",
      "enforcedBy": "review"
    }
  ],
  "figma": {
    "fileKey": null,
    "nodeId": null,
    "notes": "Not identified yet (SBP-008). A Figma counterpart is expected."
  },
  "examples": {
    "correct": [
      {
        "code": "<div aria-live=\"polite\">\n  {isRunningSuccessfully ? (\n    <StatusBadge variant=\"status\" theme=\"success\" pulse>Running</StatusBadge>\n  ) : (\n    <StatusBadge variant=\"outline\" theme=\"muted\">Not running</StatusBadge>\n  )}\n</div>",
        "source": "Loop test, Claude Code, 2026-10-20"
      }
    ],
    "incorrect": [
      {
        "code": "<div aria-live=\"polite\">\n  <StatusBadge variant=\"outline\" theme=\"success\" size=\"sm\" icon=\"check-circle\" className=\"motion-safe:animate-pulse\">\n    Running successfully\n  </StatusBadge>\n</div>",
        "violates": ["SBD-007"],
        "source": "Loop test, Codex, 2026-10-20"
      },
      {
        "code": "<StatusBadge variant=\"outline\" theme=\"danger\">Error, Pending</StatusBadge>",
        "violates": ["SBP-001"],
        "source": "The 'Error, Pending' case in the retired SBD-005"
      }
    ]
  },
  "governance": {
    "guide": "./status-badge-pattern.guide.md",
    "note": "Draft. Validated and generated by the ds:* scripts. SBP-001 to SBP-004 replace SBD-005, SBD-014, SBD-008 and SBD-015, which are retired (SBP-007)."
  },
  "knownGaps": [
    { "summary": "No mapping from ExecutionState to StatusBadge props.", "rule": "SBP-005" },
    {
      "summary": "Tree View's status icons differ from the icon table in SBD-017, and it renders error, killed and blocked as neutral.",
      "rule": "SBP-006",
      "source": "packages/ui/src/components/treeview.tsx getStatusIcon"
    },
    { "summary": "A Figma counterpart is expected but not identified.", "rule": "SBP-008" }
  ]
}
